property_url,property_id,listing_id,mls,mls_id,status,text,style,full_street_line,street,unit,city,state,zip_code,beds,full_baths,half_baths,sqft,year_built,days_on_mls,list_price,list_price_min,list_price_max,list_date,sold_price,last_sold_date,assessed_value,estimated_value,new_construction,lot_sqft,price_per_sqft,latitude,longitude,neighborhoods,county,fips_code,stories,hoa_fee,parking_garage,agent_id,agent_name,agent_email,agent_phones,agent_mls_set,agent_nrds_id,broker_id,broker_name,builder_id,builder_name,office_id,office_mls_set,office_name,office_email,office_phones,nearby_schools,primary_photo,alt_photos
https://www.realtor.com/realestateandhomes-detail/200-Maverick-Trl_Central_SC_29630_M97679-39724,9767939724,2974707214,GRSC,1541535,SOLD,"Home is Move in Ready! Welcome to The Grange! New homes in Clemson, SC! Live, work and play in the 2023 HBA of Greenville Community of the Year! Beautiful one- and two-level single family homes and townhomes including main level owners suites. Located in Clemson, SC, minutes from top ranked Clemson University, Lake Hartwell, Lake Keowee, and 35 minutes to Downtown Greenville. Situated just off Hwy. 123 and within the city limits of Clemson. Stay active with access to dining, shopping, trail systems, and the fine arts. The Grange offers award winning quality craftsman architecture, James Hardie Color Plus siding, and lawn maintenance included. This is the first phase of a master planned community within the attendance area of Clemson Elementary, R.C. Edwards Middle, and D.W. Daniel High School. Welcome home to the Sutherland! This amazing 4 bedroom home features 2600 square feet of living space sure to meet all your needs. Entering from your front porch into your spacious foyer, you have an adjacent dining room with coffered ceilings that leads into the open concept kitchen and living area. The kitchen has an oversized island with farmhouse sink, peninusla for extra prep space and seating, beautiful light grey cabinetry, white Quartz countertops, tiled backsplash, under cabinet lighting, and stainless steel appliances including a gas range/oven and built in microwave. The living room has large windows to give you plenty of natural light and the gas fireplace with 2 story stone surround gives the room a cozy feel. The breakfast area leads out to the covered back porch overlooking your backyard. The Primary Suite is also on the main level and features a generous walk in closet, double sinks and amazing Roman tiled shower with two showerheads and built in seat. Once you go up the Oak staircase that overlooks the living room, you will find three additional bedrooms and two full baths, including one with two sinks. The home also comes standard with in ground irrigation, HOA provided lawn maintenance, City Provided trash pick-up, and a great location. All our homes feature our Smart Home Technology Package including a video doorbell, keyless entry and touch screen hub. Additionally, our homes are built for efficiency and comfort helping to reduce your energy costs. Our dedicated local warranty team is here for your needs after closing as well. Come visit today or call and make The Grange your new home! See Sales Agent for additional pricing information.",SINGLE_FAMILY,200 Maverick Trl,200 Maverick Trl,,Central,SC,29630,4,3,1,2608,2024,33,579990,,,2024-11-08,559990,2024-12-11,,574000,True,12197,215,34.690894,-82.777381,,Pickens,45077,2,,2,3055776,Emily Raines,eraines@drbgroup.com,"[{'ext': None, 'primary': True, 'type': 'Mobile', 'number': '8643034693'}]",A-GRSC-4102,,3142767,Dan Ryan Builders - Greenville Sc - Broker,,,1696070,O-GRSC-1701,Dan Ryan Builders - Greenville SC,mchildress@danryanbuilders.com,"[{'number': '8642147442', 'type': 'Office', 'primary': True, 'ext': None}, {'number': '8643958211', 'type': 'Office', 'primary': True, 'ext': None}]",Pickens 01 School District,http://ap.rdcpix.com/33c66a5b618dfba334c587cda749eecdl-m1616863174od-w480_h360_x2.webp?w=1080&q=75,"http://ap.rdcpix.com/33c66a5b618dfba334c587cda749eecdl-m1616863174od-w480_h360_x2.webp?w=1080&q=75, http://ap.rdcpix.com/33c66a5b618dfba334c587cda749eecdl-m3610704665od-w480_h360_x2.webp?w=1080&q=75, http://ap.rdcpix.com/33c66a5b618dfba334c587cda749eecdl-m1777064538od-w480_h360_x2.webp?w=1080&q=75, http://ap.rdcpix.com/33c66a5b618dfba334c587cda749eecdl-m2082508500od-w480_h360_x2.webp?w=1080&q=75, http://ap.rdcpix.com/33c66a5b618dfba334c587cda749eecdl-m152613912od-w480_h360_x2.webp?w=1080&q=75, http://ap.rdcpix.com/33c66a5b618dfba334c587cda749eecdl-m2747831230od-w480_h360_x2.webp?w=1080&q=75, http://ap.rdcpix.com/33c66a5b618dfba334c587cda749eecdl-m2976353600od-w480_h360_x2.webp?w=1080&q=75, http://ap.rdcpix.com/33c66a5b618dfba334c587cda749eecdl-m1265641397od-w480_h360_x2.webp?w=1080&q=75, http://ap.rdcpix.com/33c66a5b618dfba334c587cda749eecdl-m1061716547od-w480_h360_x2.webp?w=1080&q=75, http://ap.rdcpix.com/33c66a5b618dfba334c587cda749eecdl-m1670953999od-w480_h360_x2.webp?w=1080&q=75, http://ap.rdcpix.com/33c66a5b618dfba334c587cda749eecdl-m2372323621od-w480_h360_x2.webp?w=1080&q=75, http://ap.rdcpix.com/33c66a5b618dfba334c587cda749eecdl-m481246998od-w480_h360_x2.webp?w=1080&q=75, http://ap.rdcpix.com/33c66a5b618dfba334c587cda749eecdl-m3886741333od-w480_h360_x2.webp?w=1080&q=75, http://ap.rdcpix.com/33c66a5b618dfba334c587cda749eecdl-m558072943od-w480_h360_x2.webp?w=1080&q=75, http://ap.rdcpix.com/33c66a5b618dfba334c587cda749eecdl-m3814187886od-w480_h360_x2.webp?w=1080&q=75, http://ap.rdcpix.com/33c66a5b618dfba334c587cda749eecdl-m1618100692od-w480_h360_x2.webp?w=1080&q=75, http://ap.rdcpix.com/33c66a5b618dfba334c587cda749eecdl-m480552341od-w480_h360_x2.webp?w=1080&q=75, http://ap.rdcpix.com/33c66a5b618dfba334c587cda749eecdl-m1522750460od-w480_h360_x2.webp?w=1080&q=75, http://ap.rdcpix.com/33c66a5b618dfba334c587cda749eecdl-m473768579od-w480_h360_x2.webp?w=1080&q=75, http://ap.rdcpix.com/33c66a5b618dfba334c587cda749eecdl-m2364342234od-w480_h360_x2.webp?w=1080&q=75, http://ap.rdcpix.com/33c66a5b618dfba334c587cda749eecdl-m45816644od-w480_h360_x2.webp?w=1080&q=75, http://ap.rdcpix.com/33c66a5b618dfba334c587cda749eecdl-m1762398523od-w480_h360_x2.webp?w=1080&q=75, http://ap.rdcpix.com/33c66a5b618dfba334c587cda749eecdl-m1688985514od-w480_h360_x2.webp?w=1080&q=75, http://ap.rdcpix.com/33c66a5b618dfba334c587cda749eecdl-m1826536172od-w480_h360_x2.webp?w=1080&q=75, http://ap.rdcpix.com/33c66a5b618dfba334c587cda749eecdl-m3339806551od-w480_h360_x2.webp?w=1080&q=75, http://ap.rdcpix.com/33c66a5b618dfba334c587cda749eecdl-m690671369od-w480_h360_x2.webp?w=1080&q=75, http://ap.rdcpix.com/33c66a5b618dfba334c587cda749eecdl-m3258405562od-w480_h360_x2.webp?w=1080&q=75, http://ap.rdcpix.com/33c66a5b618dfba334c587cda749eecdl-m4167343793od-w480_h360_x2.webp?w=1080&q=75, http://ap.rdcpix.com/33c66a5b618dfba334c587cda749eecdl-m2167367753od-w480_h360_x2.webp?w=1080&q=75, http://ap.rdcpix.com/33c66a5b618dfba334c587cda749eecdl-m3761536006od-w480_h360_x2.webp?w=1080&q=75"
https://www.realtor.com/realestateandhomes-detail/130-College-Heights-Blvd_Clemson_SC_29631_M59993-14073,5999314073,2973888370,ANSC,20280259,SOLD,"Great opportunity to own a single family home in Clemson city limits that is zoned RM4! There are very few properties in Clemson with this zoning. This brick ranch is currently being rented as the Phi Sigma Kappa fraternity. There are few properties which have a large living room, huge recreation room in the lower level, huge rear yard for activities, and yet are wonderfully and conveniently located so you can bike to campus as well as it being on the CAT bus route. This one level brick house has 4 bedrooms, 2 baths. New architectural shingle roof, windows throughout and rear deck in 2017. Hardwood floors throughout the home. The kitchen is spacious, has dining area, and open to the living area. Great backyard space! This is a rare opportunity to find RM4 zoning with a ready to go property and great tenants in place! Property is currently leased until 7/31/2025 at $2000/month. You will want to own this income property right away, so you can adjust the lease rental beginning on August 1st. The rent is quite low for this property. Call today and schedule your appt as this will go fast! Property is managed by Foothills Properties.",SINGLE_FAMILY,130 College Heights Blvd,130 College Heights Blvd,,Clemson,SC,29631,4,2,,3052,1972,46,349900,,,2024-10-21,342500,2024-12-06,143900,339596,False,16988,112,34.682679,-82.822156,,Pickens,45077,1,0,1,884283,Wayne Montague,wayne@bobhillrealty.com,"[{'ext': None, 'primary': True, 'type': 'Mobile', 'number': '8647106269'}, {'ext': None, 'primary': True, 'type': 'Office', 'number': '8648820855'}, {'ext': None, 'primary': True, 'type': 'Toll Free', 'number': '8003840595'}]",A-ANSC-CANANDAIGUA,759000157,1639723,Bob Hill Realty,,,1639724,O-ANSC-112,Bob Hill Realty,sales@bobhillrealty.com,"[{'number': '8648820855', 'type': 'Office', 'primary': True, 'ext': None}, {'number': '(864)882-0551', 'type': 'Fax', 'primary': False, 'ext': None}, {'number': '8647846675', 'type': 'Mobile', 'primary': True, 'ext': None}]",Pickens 01 School District,http://ap.rdcpix.com/b7c73373aeebfc1a1cc2915de3632469l-m1263893010od-w480_h360_x2.webp?w=1080&q=75,"http://ap.rdcpix.com/b7c73373aeebfc1a1cc2915de3632469l-m1263893010od-w480_h360_x2.webp?w=1080&q=75, http://ap.rdcpix.com/b7c73373aeebfc1a1cc2915de3632469l-m1633762660od-w480_h360_x2.webp?w=1080&q=75, http://ap.rdcpix.com/b7c73373aeebfc1a1cc2915de3632469l-m1503288391od-w480_h360_x2.webp?w=1080&q=75, http://ap.rdcpix.com/b7c73373aeebfc1a1cc2915de3632469l-m2982340244od-w480_h360_x2.webp?w=1080&q=75, http://ap.rdcpix.com/b7c73373aeebfc1a1cc2915de3632469l-m3120681613od-w480_h360_x2.webp?w=1080&q=75"
https://www.realtor.com/realestateandhomes-detail/108-Selby-Dr_Clemson_SC_29631_M99216-03296,9921603296,2966111176,ANSC,20273579,SOLD,"Discover Clemson's newest gem! If you missed out on Rosewood's Clemson Cottages, now is the time to buy your dream home in Clemson, SC! This low maintenance community features 20 lots perfectly located within 10 minutes of Downtown Clemson. COMING SOON! This home is the Everett plan and is under construction. Expected to be complete late 2024.",SINGLE_FAMILY,108 Selby Dr,108 Selby Dr,,Clemson,SC,29631,3,2,1,,2024,227,645500,,,2024-04-13,626000,2024-11-26,,639000,False,23522,,34.668827,-82.808228,,Pickens,45077,2,,2,4910114,Emily Batson,,,A-ANSC-747006918,,970423,RE/MAX REALTY PROFESSIONALS GREENVILLE SC,,,1194927,O-ANSC-163,RE MAX Realty Professionals,home@movingtogreenville.com,"[{'number': '8642418200', 'type': 'Office', 'primary': True, 'ext': None}, {'number': '18008497629', 'type': 'Toll Free', 'primary': True, 'ext': None}, {'number': '(864) 241-8210', 'type': 'Fax', 'primary': False, 'ext': None}]",Pickens 01 School District,http://ap.rdcpix.com/3d6e162eb5bdfaed92d0876c4ab8af7bl-b1674736048od-w480_h360_x2.webp?w=1080&q=75,http://ap.rdcpix.com/3d6e162eb5bdfaed92d0876c4ab8af7bl-b1674736048od-w480_h360_x2.webp?w=1080&q=75
https://www.realtor.com/realestateandhomes-detail/107-Charissa-Dr_Clemson_SC_29631_M68872-88173,6887288173,2976013367,ANSC,20280474,SOLD,"Well maintained Clemson home with detached 600 sq workshop. This home offers the tranquility of a quiet Clemson neighborhood along with being conveniently located to Clemson Elementary, Clemson University, shopping, and biking trails.The floor plan of this home offers flexible living choices with formal dining, living area, den and large lower level which offers flexibility as a large recreation area or owners suite. HVAC installed in August along with new appliances. Large workshop along with work area off of attached garage. Don't miss seeing this home!",SINGLE_FAMILY,107 Charissa Dr,107 Charissa Dr,,Clemson,SC,29631,5,3,,2712,,0,475000,,,2024-12-09,450000,2024-12-09,239000,477040,False,41382,166,34.684331,-82.809765,,Pickens,45077,2,0,2,3352139,Lisa Richardson,lisa@carolina-realestate.com,"[{'ext': None, 'primary': True, 'type': 'Office', 'number': '8647100304'}]",A-ANSC-LJRICH56,759000169,4550100,REMAX FOOTHILLS (Clemson) -  Broker,,,14837,O-ANSC-59,Carolina Foothills Real Estate,rbhebert@innova.net,"[{'number': '8646544345', 'type': 'Office', 'primary': True, 'ext': None}, {'number': '8646542245', 'type': 'Fax', 'primary': False, 'ext': None}]",Pickens 01 School District,http://ap.rdcpix.com/33cf4e26c9feef61a58fb9cbffa85481l-m462185862od-w480_h360_x2.webp?w=1080&q=75,"http://ap.rdcpix.com/33cf4e26c9feef61a58fb9cbffa85481l-m462185862od-w480_h360_x2.webp?w=1080&q=75, http://ap.rdcpix.com/33cf4e26c9feef61a58fb9cbffa85481l-m1106933214od-w480_h360_x2.webp?w=1080&q=75, http://ap.rdcpix.com/33cf4e26c9feef61a58fb9cbffa85481l-m3780753908od-w480_h360_x2.webp?w=1080&q=75, http://ap.rdcpix.com/33cf4e26c9feef61a58fb9cbffa85481l-m923068635od-w480_h360_x2.webp?w=1080&q=75, http://ap.rdcpix.com/33cf4e26c9feef61a58fb9cbffa85481l-m2330420546od-w480_h360_x2.webp?w=1080&q=75, http://ap.rdcpix.com/33cf4e26c9feef61a58fb9cbffa85481l-m2310569072od-w480_h360_x2.webp?w=1080&q=75, http://ap.rdcpix.com/33cf4e26c9feef61a58fb9cbffa85481l-m630087790od-w480_h360_x2.webp?w=1080&q=75, http://ap.rdcpix.com/33cf4e26c9feef61a58fb9cbffa85481l-m1223258249od-w480_h360_x2.webp?w=1080&q=75, http://ap.rdcpix.com/33cf4e26c9feef61a58fb9cbffa85481l-m3458963425od-w480_h360_x2.webp?w=1080&q=75, http://ap.rdcpix.com/33cf4e26c9feef61a58fb9cbffa85481l-m787069172od-w480_h360_x2.webp?w=1080&q=75, http://ap.rdcpix.com/33cf4e26c9feef61a58fb9cbffa85481l-m2019973592od-w480_h360_x2.webp?w=1080&q=75, http://ap.rdcpix.com/33cf4e26c9feef61a58fb9cbffa85481l-m3177310833od-w480_h360_x2.webp?w=1080&q=75, http://ap.rdcpix.com/33cf4e26c9feef61a58fb9cbffa85481l-m1784784655od-w480_h360_x2.webp?w=1080&q=75, http://ap.rdcpix.com/33cf4e26c9feef61a58fb9cbffa85481l-m3270096077od-w480_h360_x2.webp?w=1080&q=75, http://ap.rdcpix.com/33cf4e26c9feef61a58fb9cbffa85481l-m2184632641od-w480_h360_x2.webp?w=1080&q=75, http://ap.rdcpix.com/33cf4e26c9feef61a58fb9cbffa85481l-m3142014322od-w480_h360_x2.webp?w=1080&q=75, http://ap.rdcpix.com/33cf4e26c9feef61a58fb9cbffa85481l-m3601055482od-w480_h360_x2.webp?w=1080&q=75, http://ap.rdcpix.com/33cf4e26c9feef61a58fb9cbffa85481l-m521550851od-w480_h360_x2.webp?w=1080&q=75, http://ap.rdcpix.com/33cf4e26c9feef61a58fb9cbffa85481l-m2192466990od-w480_h360_x2.webp?w=1080&q=75, http://ap.rdcpix.com/33cf4e26c9feef61a58fb9cbffa85481l-m2053424597od-w480_h360_x2.webp?w=1080&q=75, http://ap.rdcpix.com/33cf4e26c9feef61a58fb9cbffa85481l-m904045916od-w480_h360_x2.webp?w=1080&q=75, http://ap.rdcpix.com/33cf4e26c9feef61a58fb9cbffa85481l-m489560155od-w480_h360_x2.webp?w=1080&q=75, http://ap.rdcpix.com/33cf4e26c9feef61a58fb9cbffa85481l-m2202800434od-w480_h360_x2.webp?w=1080&q=75, http://ap.rdcpix.com/33cf4e26c9feef61a58fb9cbffa85481l-m2583597524od-w480_h360_x2.webp?w=1080&q=75, http://ap.rdcpix.com/33cf4e26c9feef61a58fb9cbffa85481l-m3102945108od-w480_h360_x2.webp?w=1080&q=75, http://ap.rdcpix.com/33cf4e26c9feef61a58fb9cbffa85481l-m2441722439od-w480_h360_x2.webp?w=1080&q=75, http://ap.rdcpix.com/33cf4e26c9feef61a58fb9cbffa85481l-m3062871392od-w480_h360_x2.webp?w=1080&q=75, http://ap.rdcpix.com/33cf4e26c9feef61a58fb9cbffa85481l-m748463544od-w480_h360_x2.webp?w=1080&q=75, http://ap.rdcpix.com/33cf4e26c9feef61a58fb9cbffa85481l-m1357254433od-w480_h360_x2.webp?w=1080&q=75, http://ap.rdcpix.com/33cf4e26c9feef61a58fb9cbffa85481l-m3459342027od-w480_h360_x2.webp?w=1080&q=75, http://ap.rdcpix.com/33cf4e26c9feef61a58fb9cbffa85481l-m1620811670od-w480_h360_x2.webp?w=1080&q=75, http://ap.rdcpix.com/33cf4e26c9feef61a58fb9cbffa85481l-m80863881od-w480_h360_x2.webp?w=1080&q=75, http://ap.rdcpix.com/33cf4e26c9feef61a58fb9cbffa85481l-m1744735020od-w480_h360_x2.webp?w=1080&q=75, http://ap.rdcpix.com/33cf4e26c9feef61a58fb9cbffa85481l-m175309502od-w480_h360_x2.webp?w=1080&q=75, http://ap.rdcpix.com/33cf4e26c9feef61a58fb9cbffa85481l-m1011651701od-w480_h360_x2.webp?w=1080&q=75, http://ap.rdcpix.com/33cf4e26c9feef61a58fb9cbffa85481l-m3768327130od-w480_h360_x2.webp?w=1080&q=75"
https://www.realtor.com/realestateandhomes-detail/247-Riggs-Dr_Clemson_SC_29631_M59289-97611,5928997611,2974146160,ANSC,20280538,SOLD,"Outstanding, well kept brick home in downtown Clemson. Located in the highly desirable, walking distance area of Riggs Drive, this home ha been well cared for with many recent upgrades to include new roof and oversized gutters. The home features a large, open living dining combo as you enter the front door that is complimented by an remodeled kitchen that opens to a comfortable den. The adjoining sun room and new deck make for great entertainment space and also allow for lots of natural light. Beautiful guest bath and guest bedroom are conveniently located just off the entry foyer and the Master bedroom i located at end of Hallway. Owners encompassed the 3rd guest bedroom and remodeled that space into a large, master bathrooom/closet area. The lower level features a 2nd fireplace, rec room, storage/unfinished space and the 3rd bedroom and full bath. Access to a very nice patio leads to a very private, level back yard with former garden area. The entire lawn is beautiful, well-maintained zoysia and is very level.",SINGLE_FAMILY,247 Riggs Dr,247 Riggs Dr,,Clemson,SC,29631,3,3,,2660,1955,42,669000,,,2024-10-25,662000,2024-12-06,279700,660104,False,,249,34.688028,-82.830809,,Pickens,45077,1,0,1,1621757,Russ Hebert,rbhebert@innova.net,"[{'ext': None, 'primary': True, 'type': 'Home', 'number': '(864) 654-7700'}]",A-ANSC-RBHEBERT,,4550100,REMAX FOOTHILLS (Clemson) -  Broker,,,14837,O-ANSC-59,Carolina Foothills Real Estate,rbhebert@innova.net,"[{'number': '8646544345', 'type': 'Office', 'primary': True, 'ext': None}, {'number': '8646542245', 'type': 'Fax', 'primary': False, 'ext': None}]",Pickens 01 School District,http://ap.rdcpix.com/78577748ca23c39a293c3687ddc3e316l-b2654006592od-w480_h360_x2.webp?w=1080&q=75,"http://ap.rdcpix.com/78577748ca23c39a293c3687ddc3e316l-b2654006592od-w480_h360_x2.webp?w=1080&q=75, http://ap.rdcpix.com/78577748ca23c39a293c3687ddc3e316l-b82942066od-w480_h360_x2.webp?w=1080&q=75, http://ap.rdcpix.com/78577748ca23c39a293c3687ddc3e316l-b1749821672od-w480_h360_x2.webp?w=1080&q=75, http://ap.rdcpix.com/78577748ca23c39a293c3687ddc3e316l-b1272865568od-w480_h360_x2.webp?w=1080&q=75, http://ap.rdcpix.com/78577748ca23c39a293c3687ddc3e316l-b2626067720od-w480_h360_x2.webp?w=1080&q=75, http://ap.rdcpix.com/78577748ca23c39a293c3687ddc3e316l-b3510652713od-w480_h360_x2.webp?w=1080&q=75, http://ap.rdcpix.com/78577748ca23c39a293c3687ddc3e316l-b360935173od-w480_h360_x2.webp?w=1080&q=75, http://ap.rdcpix.com/78577748ca23c39a293c3687ddc3e316l-b2525748016od-w480_h360_x2.webp?w=1080&q=75, http://ap.rdcpix.com/78577748ca23c39a293c3687ddc3e316l-b228741056od-w480_h360_x2.webp?w=1080&q=75, http://ap.rdcpix.com/78577748ca23c39a293c3687ddc3e316l-b4154008191od-w480_h360_x2.webp?w=1080&q=75, http://ap.rdcpix.com/78577748ca23c39a293c3687ddc3e316l-b1334875265od-w480_h360_x2.webp?w=1080&q=75, http://ap.rdcpix.com/78577748ca23c39a293c3687ddc3e316l-b3927415252od-w480_h360_x2.webp?w=1080&q=75, http://ap.rdcpix.com/78577748ca23c39a293c3687ddc3e316l-b3941763760od-w480_h360_x2.webp?w=1080&q=75, http://ap.rdcpix.com/78577748ca23c39a293c3687ddc3e316l-b160728890od-w480_h360_x2.webp?w=1080&q=75, http://ap.rdcpix.com/78577748ca23c39a293c3687ddc3e316l-b2098602464od-w480_h360_x2.webp?w=1080&q=75, http://ap.rdcpix.com/78577748ca23c39a293c3687ddc3e316l-b1646067079od-w480_h360_x2.webp?w=1080&q=75, http://ap.rdcpix.com/78577748ca23c39a293c3687ddc3e316l-b659420613od-w480_h360_x2.webp?w=1080&q=75, http://ap.rdcpix.com/78577748ca23c39a293c3687ddc3e316l-b3055221222od-w480_h360_x2.webp?w=1080&q=75, http://ap.rdcpix.com/78577748ca23c39a293c3687ddc3e316l-b834085606od-w480_h360_x2.webp?w=1080&q=75, http://ap.rdcpix.com/78577748ca23c39a293c3687ddc3e316l-b2348109219od-w480_h360_x2.webp?w=1080&q=75, http://ap.rdcpix.com/78577748ca23c39a293c3687ddc3e316l-b3497547319od-w480_h360_x2.webp?w=1080&q=75, http://ap.rdcpix.com/78577748ca23c39a293c3687ddc3e316l-b1058073095od-w480_h360_x2.webp?w=1080&q=75, http://ap.rdcpix.com/78577748ca23c39a293c3687ddc3e316l-b1026718226od-w480_h360_x2.webp?w=1080&q=75, http://ap.rdcpix.com/78577748ca23c39a293c3687ddc3e316l-b628909750od-w480_h360_x2.webp?w=1080&q=75, http://ap.rdcpix.com/78577748ca23c39a293c3687ddc3e316l-b3238108174od-w480_h360_x2.webp?w=1080&q=75, http://ap.rdcpix.com/78577748ca23c39a293c3687ddc3e316l-b4188531843od-w480_h360_x2.webp?w=1080&q=75, http://ap.rdcpix.com/78577748ca23c39a293c3687ddc3e316l-b3488025686od-w480_h360_x2.webp?w=1080&q=75, http://ap.rdcpix.com/78577748ca23c39a293c3687ddc3e316l-b4214348890od-w480_h360_x2.webp?w=1080&q=75, http://ap.rdcpix.com/78577748ca23c39a293c3687ddc3e316l-b2416574737od-w480_h360_x2.webp?w=1080&q=75, http://ap.rdcpix.com/78577748ca23c39a293c3687ddc3e316l-b3252877769od-w480_h360_x2.webp?w=1080&q=75, http://ap.rdcpix.com/78577748ca23c39a293c3687ddc3e316l-b2638229727od-w480_h360_x2.webp?w=1080&q=75, http://ap.rdcpix.com/78577748ca23c39a293c3687ddc3e316l-b1364387133od-w480_h360_x2.webp?w=1080&q=75, http://ap.rdcpix.com/78577748ca23c39a293c3687ddc3e316l-b2258274158od-w480_h360_x2.webp?w=1080&q=75"
https://www.realtor.com/realestateandhomes-detail/101-Selby-Dr_Clemson_SC_29631_M91161-59863,9116159863,2953689107,ANSC,20260394,SOLD,"Discover Clemson's newest gem! If you missed out on Rosewood's Clemson Cottages, now is the time to buy your dream home in Clemson, SC! This low maintenance community features 20 lots perfectly located within 10 minutes of Downtown Clemson.",SINGLE_FAMILY,101 Selby Dr,101 Selby Dr,,Clemson,SC,29631,3,2,1,,,613,579900,,,2023-03-18,554013,2024-11-20,,600000,True,,,34.668682,-82.807266,,Pickens,45077,1,,2,4910114,Emily Batson,,,A-ANSC-747006918,,970423,RE/MAX REALTY PROFESSIONALS GREENVILLE SC,,,1194927,O-ANSC-163,RE MAX Realty Professionals,home@movingtogreenville.com,"[{'number': '8642418200', 'type': 'Office', 'primary': True, 'ext': None}, {'number': '18008497629', 'type': 'Toll Free', 'primary': True, 'ext': None}, {'number': '(864) 241-8210', 'type': 'Fax', 'primary': False, 'ext': None}]",Pickens 01 School District,http://ap.rdcpix.com/1d49bb182aa660e92ee3aa1b91a72119l-b3197104702od-w480_h360_x2.webp?w=1080&q=75,"http://ap.rdcpix.com/1d49bb182aa660e92ee3aa1b91a72119l-b3197104702od-w480_h360_x2.webp?w=1080&q=75, http://ap.rdcpix.com/1d49bb182aa660e92ee3aa1b91a72119l-b2239104879od-w480_h360_x2.webp?w=1080&q=75, http://ap.rdcpix.com/1d49bb182aa660e92ee3aa1b91a72119l-b1079254485od-w480_h360_x2.webp?w=1080&q=75, http://ap.rdcpix.com/1d49bb182aa660e92ee3aa1b91a72119l-b867354626od-w480_h360_x2.webp?w=1080&q=75, http://ap.rdcpix.com/1d49bb182aa660e92ee3aa1b91a72119l-b3561642596od-w480_h360_x2.webp?w=1080&q=75, http://ap.rdcpix.com/1d49bb182aa660e92ee3aa1b91a72119l-b1888568550od-w480_h360_x2.webp?w=1080&q=75, http://ap.rdcpix.com/1d49bb182aa660e92ee3aa1b91a72119l-b2577041660od-w480_h360_x2.webp?w=1080&q=75, http://ap.rdcpix.com/1d49bb182aa660e92ee3aa1b91a72119l-b4137928380od-w480_h360_x2.webp?w=1080&q=75, http://ap.rdcpix.com/1d49bb182aa660e92ee3aa1b91a72119l-b2476339643od-w480_h360_x2.webp?w=1080&q=75, http://ap.rdcpix.com/1d49bb182aa660e92ee3aa1b91a72119l-b1480740866od-w480_h360_x2.webp?w=1080&q=75, http://ap.rdcpix.com/1d49bb182aa660e92ee3aa1b91a72119l-b740505639od-w480_h360_x2.webp?w=1080&q=75, http://ap.rdcpix.com/1d49bb182aa660e92ee3aa1b91a72119l-b160944373od-w480_h360_x2.webp?w=1080&q=75, http://ap.rdcpix.com/1d49bb182aa660e92ee3aa1b91a72119l-b3780229218od-w480_h360_x2.webp?w=1080&q=75, http://ap.rdcpix.com/1d49bb182aa660e92ee3aa1b91a72119l-b627669515od-w480_h360_x2.webp?w=1080&q=75, http://ap.rdcpix.com/1d49bb182aa660e92ee3aa1b91a72119l-b358640610od-w480_h360_x2.webp?w=1080&q=75, http://ap.rdcpix.com/1d49bb182aa660e92ee3aa1b91a72119l-b2574534103od-w480_h360_x2.webp?w=1080&q=75, http://ap.rdcpix.com/1d49bb182aa660e92ee3aa1b91a72119l-b1387683621od-w480_h360_x2.webp?w=1080&q=75, http://ap.rdcpix.com/1d49bb182aa660e92ee3aa1b91a72119l-b1763226997od-w480_h360_x2.webp?w=1080&q=75, http://ap.rdcpix.com/1d49bb182aa660e92ee3aa1b91a72119l-b2785522071od-w480_h360_x2.webp?w=1080&q=75, http://ap.rdcpix.com/1d49bb182aa660e92ee3aa1b91a72119l-b2485725313od-w480_h360_x2.webp?w=1080&q=75, http://ap.rdcpix.com/1d49bb182aa660e92ee3aa1b91a72119l-b2952945927od-w480_h360_x2.webp?w=1080&q=75, http://ap.rdcpix.com/1d49bb182aa660e92ee3aa1b91a72119l-b558453720od-w480_h360_x2.webp?w=1080&q=75, http://ap.rdcpix.com/1d49bb182aa660e92ee3aa1b91a72119l-b183635599od-w480_h360_x2.webp?w=1080&q=75, http://ap.rdcpix.com/1d49bb182aa660e92ee3aa1b91a72119l-b454454588od-w480_h360_x2.webp?w=1080&q=75, http://ap.rdcpix.com/1d49bb182aa660e92ee3aa1b91a72119l-b1528572188od-w480_h360_x2.webp?w=1080&q=75, http://ap.rdcpix.com/1d49bb182aa660e92ee3aa1b91a72119l-b3359439954od-w480_h360_x2.webp?w=1080&q=75, http://ap.rdcpix.com/1d49bb182aa660e92ee3aa1b91a72119l-b1674183760od-w480_h360_x2.webp?w=1080&q=75, http://ap.rdcpix.com/1d49bb182aa660e92ee3aa1b91a72119l-b1622493274od-w480_h360_x2.webp?w=1080&q=75, http://ap.rdcpix.com/1d49bb182aa660e92ee3aa1b91a72119l-b1075261657od-w480_h360_x2.webp?w=1080&q=75, http://ap.rdcpix.com/1d49bb182aa660e92ee3aa1b91a72119l-b812892641od-w480_h360_x2.webp?w=1080&q=75, http://ap.rdcpix.com/1d49bb182aa660e92ee3aa1b91a72119l-b130274558od-w480_h360_x2.webp?w=1080&q=75, http://ap.rdcpix.com/1d49bb182aa660e92ee3aa1b91a72119l-b1692983522od-w480_h360_x2.webp?w=1080&q=75, http://ap.rdcpix.com/1d49bb182aa660e92ee3aa1b91a72119l-b1791941304od-w480_h360_x2.webp?w=1080&q=75, http://ap.rdcpix.com/1d49bb182aa660e92ee3aa1b91a72119l-b1002669757od-w480_h360_x2.webp?w=1080&q=75, http://ap.rdcpix.com/1d49bb182aa660e92ee3aa1b91a72119l-b131743817od-w480_h360_x2.webp?w=1080&q=75, http://ap.rdcpix.com/1d49bb182aa660e92ee3aa1b91a72119l-b1373894479od-w480_h360_x2.webp?w=1080&q=75, http://ap.rdcpix.com/1d49bb182aa660e92ee3aa1b91a72119l-b3707682814od-w480_h360_x2.webp?w=1080&q=75"
